<?xml version="1.0" encoding="UTF-8" ?>

<xs:schema xmlns:xs="http://www.w3.org/2001/XMLSchema">

	<xs:element name="receta">
		<xs:complexType>
			<xs:sequence>

				<xs:element name="medicamento" type="xs:string"
					maxOccurs="unbounded" />

				<xs:element name="farmacia" type="xs:string"
					default="Farmacia Juaneda" />

				<xs:element name="edad">
					<xs:simpleType>
						<xs:restriction base="xs:integer">
							<xs:minInclusive value="0" />
							<xs:maxInclusive value="150" />
						</xs:restriction>
					</xs:simpleType>
				</xs:element>

				<xs:element name="nombre">
					<xs:simpleType>
						<xs:restriction base="xs:string">
							<xs:maxLength value="50" />
						</xs:restriction>
					</xs:simpleType>
				</xs:element>

				<xs:element name="pago">
					<xs:simpleType>
						<xs:restriction base="xs:string">
							<xs:enumeration value="Íntegro" />
							<xs:enumeration value="Copago" />
							<xs:enumeration value="Gratuito" />
						</xs:restriction>
					</xs:simpleType>
				</xs:element>

				<xs:element name="dni">
					<xs:simpleType>
						<xs:restriction base="xs:string">
							<xs:pattern value="\d{8}[A-Z]" />
						</xs:restriction>
					</xs:simpleType>
				</xs:element>

				<xs:element name="medico">
					<xs:complexType>
						<xs:simpleContent>
							<xs:extension base="xs:string">
								<xs:attribute name="numColegiado" type="xs:integer" />
							</xs:extension>
						</xs:simpleContent>
					</xs:complexType>
				</xs:element>

				<xs:element name="posologia" type="TipoPosologia" />

				<xs:element name="alergias">
					<xs:complexType />
				</xs:element>

				<xs:element name="grupo_sanguineo">
					<xs:complexType>
						<xs:attribute name="tipo" type="xs:string" />
					</xs:complexType>
				</xs:element>

				<xs:element name="instrucciones">
					<xs:complexType mixed="true">
						<xs:sequence>
							<xs:element name="b" type="xs:string"
								maxOccurs="unbounded" />
						</xs:sequence>
					</xs:complexType>
				</xs:element>

			</xs:sequence>
		</xs:complexType>
	</xs:element>

	<xs:complexType name="TipoPosologia">
		<xs:sequence>
			<xs:element name="tomas" type="xs:positiveInteger" />
			<xs:element name="horario" type="xs:string" />
		</xs:sequence>
	</xs:complexType>



</xs:schema>
















