<?xml version="1.0" encoding="UTF-8"?>

<receta xmlns:xsi="http://www.w3.org/2001/XMLSchema-instance"
    xsi:noNamespaceSchemaLocation="receta.xsd">

    <medicamento>Paracetamol</medicamento>
    <medicamento>Omeprazol</medicamento>

    <farmacia>Farmacia Juaneda</farmacia>

    <edad>70</edad>

    <nombre>Francisco Santos</nombre>

    <pago>Gratuito</pago>

    <dni>22119029H</dni>

    <medico numColegiado="171612713">Juan Ríos</medico>

    <posologia>
        <tomas>3</tomas>
        <horario>Mañana, tarde y noche</horario>
    </posologia>

</receta>